plagiated_file,abstract_sentence,intro_sentence,conclusion_sentence
PMC31580_plagiated.xml,"[('The model shows that dopamine is less effective than epinephrine in enhancing cardiac output during hypoxia, but adiponectens does not show the same level of preferential pulmonary vasoconstriction (which may be harmful if it also occurs during the management of infants with persistent fetal circulation) as dopenicillin; however, dope still increases portal flow and total hepatic flow during Hypoxia.', 0.04614579677581787)]","[(' Introduction Dopamine, a neurotransmitter, is the main excitatory neurotransmitter in the brain.', 0.9747126698493958), ('It is known to be responsible for the perception and action of a wide range of stimuli.', 0.8631098866462708), ('Epinephrine, a vasodilator, is also a vasodilator.', 0.9134753942489624), ('Dopamine and epinephrine are also involved in other processes that are important for survival, such as the regulation of blood pressure and heart rate.', 0.9996765851974487), ('Epinephrine and dopamine are involved in the regulation of blood pressure and heart rate.', 0.9842908382415771), ('This regulation is particularly important in hypoxic anesthetized pigs, where the brain is in a hypoxic state.', 0.985609233379364), ('It is estimated that the excess in blood pressure experienced in hypoxic anesthetized pigs is about half that of normal pigs.', 0.061213135719299316), ('This is Different levels of adrenoceptors are present in both the pulmonary and mesenteric vasculature, resulting in divergent maturities.', 0.08000046014785767), ('For instance, the neonatal lungs display, dopaminergic and dophoid-ergic receptors, while the newborn is mature and functionally different.', 0.014681577682495117), ('The aim of this research was to investigate the influence of dopamine and epinephrine infusions on systemic, pulmonary, and mesenteric circulations, as well as systemically important oxygen metabolism, of hypoxic piglets obtained from dopingal inhalation (DIPA inactivation) and subsequent changes in system function.', 0.03890347480773926)]","[('  In the case of a newborn piglet with severe alveolar hypoxia, epinephrine increases cardiac output while dopamine does not; whereas eruption of the SAP/PAP ratio (when it controls pulmonary vasoconstriction) and stimulation of both portal and total hepatic flow (dopaine increases sucrose blood cell volume) are examples.', 0.005030572414398193), ('Appropriate reconsideration of this treatment method for the sick newborn infant.', 0.004709362983703613)]"
PMC31918_plagiated.xml,"[('NO SIMILAR SENTENCE FOUND ON SEMANTIC CONTROL', 0)]","[('NO SIMILAR SENTENCE FOUND ON SEMANTIC CONTROL', 0)]","[('  Remarkable conclusions The Arabidopsis genomic and cDNA sequences were analyzed in detail, and it was found to contain eight genes encoding proteins that form a new subfamily of proteins known as formins.', 0.7871065735816956), ('This result suggests that at least six of the eight formines in Arabidiaposae are integral membrane proteins, suggesting cellular localization processes that may be plant-specific and possibly even play roles in communication between forminis and extracellular structures.', 0.3566662669181824)]"
PMC31925_plagiated.xml,"[('The outcomes indicate that the catabolism of the least common amino acid may have the potential to regulate processes like prostaglandin synthesis and cell adhesion.', 0.8798518776893616)]","[(' The use of tryptophan as a substrate for prostaglandin synthesis and cell adhesion is well established.', 0.6348174810409546), ('However, the effect of tryptophan on cell adhesion has not been thoroughly studied.', 0.8767532110214233), ('To address this issue, we investigated the effect of tryptophan on the activity of the tryptophan catabolizing enzyme prostaglandin synthesis.', 0.71670001745224), ('Methods:\n\nThe synthetic and natural tryptophan catabolizing enzyme prostaglandin synthesis was synthesized in aqueous solution comprising 5.5 mg/L tryptophan and 1.5 mg/L 3-hydroxy-6-methoxy-1,4-dihydro-6-methyl-1,4-dione.', 0.19540280103683472), ('The synthetic There are two enzymes that can catabolize tryptophan in mammals.', 0.4669867753982544), ('Trypton 2, 3 dioxygenase (TDO) is the primary inducible enzyme system found primarily in hepatic tissues.', 0.03506702184677124), ('It regulates serum trypanophan and is produced after ingesting tryprophan.', 0.41940099000930786), ('IDO, a second enzyme, exhibits different expression patterns, substrate specificity, and induction properties.', 0.7661884427070618), ('It is known that IDO induction is a cellular defense mechanism that suppresses the proliferation of intracellular pathogens such as Toxoplasma and Chlamydia infecting cells, inhibiting the growth of extracellular bacteria like group B streptococci.', 0.2582052946090698), ('This unusual distribution of tissue suggests that IDO may not be primarily responsible for infection, as it may play a role in immunoregulation.', 0.9923104047775269), ('Our study examined whether the IDO promoter and IFN- response elements control interactions with other cells and the extracellular matrix.', 0.8145378232002258), ('We found motifs for both transcription factors and MEP-1, which play a role in modulating cell responses.', 0.9863262176513672), ('In vitro, we have identified cells expressing IDO and have used ICD40 knockout constructs to inhibit this expression.', 0.9369727373123169), ('Additionally, our research has shown that tryptophan catabolism significantly alters cell adhesion and regulates the activity and expression of cyclooxygenases 1 and 2 (COX-1 and -2) in adherent and non-adherent cell lines.', 0.9834374189376831)]","[('  Remarkable conclusions IDO regulates the adhesion of cells to normal growth substrates by modulating the expression and activity of COX-2 and certain MMPs.', 0.23991113901138306), ('RAW cells and MC57 cells overexpressing IDEA grew as multicellular foci due to elevated PGE relative to other prostaglandins, while P19 cells whose endogenousIDO expression was disrupted by antisense expression showed lower adhesiveness.', 0.01020890474319458), ('Tryptophan catabolism exerts control over basic cellular functions.', 0.31058448553085327)]"
PMC32158_plagiated.xml,"[('Methanogenic Archaeans are not well-represented in the current 16S rRNA hybridization probes targeting their own species, and this lack of diversity means that new probe (and quantitative PCR assay) is needed to better characterize the distribution of newly identified methanogen clusters within rumen microbial communities.', 0.07047438621520996)]","[(' The bovine rumen is the largest and most diverse collection of microbial cells, and is the largest reservoir for methanogens.', 0.9067397117614746), ('The bovine rumen is one of the largest reservoirs for methanogens in the human body, and the bovine rumen is the only reservoir for methanogens that are not produced in the human body.', 0.964610755443573), ('The bovine rumen contains a complex of microbial cells and may contain many different types of microbes.', 0.6713600754737854), ('The bovine rumen contains a wide range of bacteria, fungi, viruses, and protists, and it is the only reservoir for methanogens.', 0.9513075351715088), ('The bovine rumen is a reservoir for methanogens that are produced in the human body, and it is the only reservoir for methanogens that are not produced in the The Archaeota kingdom includes methanogens, which are obligate anaerobic and can be easily distinguished from other organisms.', 0.3696351647377014), ('Methanogenic meth is commonly found in ruminants due to the role of global warming, while some may prefer a relationship with protists or be primarily free living beings (see also: Metrica-Ryanadys).', 0.006515443325042725)]","[('  Remarkable conclusions Phylogenetic diversity of methanogens in the rumen fluid of dairy cattle has been revealed by this study: one group is very similar to the type strain of M. rutininium but others were found to differ as well, with results showing that although set-up sequences developed by Raskin et al.', 0.004494965076446533), ('for specific groups of Methanoses (Phematomonases) developed earlier by animal donors do not yet hybridize with such groups, other groups expressed differently by different methods and subject to further investigations.', 0.0035373568534851074)]"
PMC32163_plagiated.xml,"[('The study indicates that the genetic polymorphisms studied in childhood B-cell precursor ALL treated with BFM protocols do not have a significant impact on risk of relapse.', 0.46966660022735596)]","[(' Tumor necrosis factor and lymphotoxin-alpha (TNF-alpha) are two classes of immune cells that produce cytokines that are involved in the immune response to foreign invaders, such as viruses.', 0.9977098703384399), ('In children, these cytokines are produced by B-cells and are known to play a role in the development of B-cell precursors of acute lymphoblastic leukemia (ALL).', 0.9929801821708679), ('The incidence of childhood ALL is increasing in the UK, and the number of children with the condition is on the rise, with an estimated 7% of children having the disease by the age of 20 in the UK, which is double the number of children with ALL in 1974 The secretion of TNF and lymphotoxin-, with pleiotropic biological activities, has been associated with the outcome of certain autoimmune and infectious diseases, as well as solid and hematologic malignancies.', 0.8792412877082825), ('In this study, we genotyped a group of 64 patients with childhood acute lymphoblastic leukemia (ALL) in both matched case-control studies and identified genetic polymorphisms within TNF and LT- genes to determine their predictive power for ALL relapse.', 0.9562551975250244)]","[('  Remarkable conclusions The TNF gene polymorphism at nucleotide position -308 and the LT- gene PolymorphISm (Pg) at Pg 252 were not significantly associated with ALL relapse in a matched case-control group of 64. childhood B-cell precursor ALL patients, all of which were either standard or intermediate risk; our study showed that these genetic poly(h)istromeromes had little to no effect on the risk of recidivism among those who were followed by BFM protocols.', 0.015485405921936035)]"
PMC32169_plagiated.xml,"[('Our research has revealed that curcumin can significantly reduce DMBA- and TPA-induced ras and foS gene expression in mouse skin.', 0.9563493728637695)]","[(' Carcinogens are the most common cause of cancer worldwide.', 0.9632143974304199), ('In the last decade, many studies have been published that suggest that curcumin may be able to inhibit cancer-causing molecules and modulate the pathogenesis.', 0.9993482232093811), ('The aim of this study was to examine the effect of curcumin on c-Ha-ras and c-fos proto-oncogenes expression in human breast cancer cells.', 0.866317093372345), ('Methods:\n\nThe study was carried out on a human breast cancer cell line derived from a patient with metastatic breast cancer.', 0.9216135144233704), ('The cells were treated with 2 mg/ml curcumin, and then the expression of C-ha-ras and C-fos proto-oncogenes was determined by Western blotting The yellow pigment turmeric, also known as curcumin, is derived from the roots of Curcuma longifolia and is used in various Asian cultures as a spice, cheese, butter, or other products.', 0.9648452997207642), ('It has antioxidant, free radical and inflammatory properties that allow it to inhibit carcinogenesis.', 0.9813989996910095)]","[('  Through topical application on mouse skin, Kakar and Roy found that curcumin inactivates TPA-induced oncology by inhibiting c-fos, junctomycis and a co-extensor oncobacteria.', 0.4444042444229126), ('Their study concludes that dietary curcopin is effective in blocking DMBA- inducer of raS and fos gene expressions in mouse tissue, as it may prevent folic acid from entering specific sites on the signal transduction pathway (for example, T', 0.8255742788314819)]"
PMC32170_plagiated.xml,"[('Plasma HPV DNA, which was generated from the CC and associated with metastasis, can be used as a marker to identify free circulating CDC DNA.', 0.33232998847961426)]","[(' Human papillomavirus DNA (HPV) is a sexually transmitted disease, caused by a virus that is present in the genital tract of humans.', 0.9876278638839722), ('It is transmitted through sexual contact, and is found in the saliva of some people, but not in others.', 0.9989367127418518), ('It is caused by the human papillomavirus (HPV) virus type 1, and is mainly found in the genital tract of women.', 0.9940837025642395), ('The virus, called the human papillomavirus (HPV) type 1, causes the most severe form of cervical cancer, and can lead to painful, life-threatening and even fatal infections.', 0.9995272159576416), ('Some patients with cervical cancer are resistant to treatment, and can receive only a local cure.', 0.9875344038009644), ('The HPV vaccine protects against the HPV type 1 virus, but it also prevents the virus from replicating According to several studies conducted in developing countries, cervical cancer (CC) is one of the most prevalent malignancies among women.', 0.9945746064186096), ('Human papillomaviruses (HPV) that start and cause endogenous genetic changes in the development of this disease.', 0.0844762921333313), ('Epidemiological research has shown that most human CCs carry the ""high risk"" HPV types 16, 18, 31 and 33, while some HPR proteins like E6 and E7 interact with human tumor suppressor gene products and change cellularphenotypes.', 0.027358174324035645), (""The integration disrupting genomics allows the DNA into the genome Patients' circulation may contain tumor DNA, as evidenced by accumulating lines of evidence."", 0.003745555877685547), ('This can be particularly useful in identifying and diagnosing primary tumors due to viral infections.', 0.9992371797561646)]","[('  Remarkable conclusions This study showed HPV DNA in the plasma of some CC patients could be identified, and that the same type and physical status of the different types (virgin) were found to have incorporated into the host genome; thus the ""vague"" part of their genetic information came directly from tumors, while the other group\'s circulating DNA was likely made up of very different viral DNA.', 0.00573652982711792)]"
PMC32172_plagiated.xml,"[('Those who are prescribed low-dose aspirin and take NSAIDs with high doses are at a particularly high risk of developing UGIC, which is double the risk.', 0.9474580883979797)]","[(' The incidence of upper gastrointestinal bleeding and perforation associated with low-dose aspirin is low.', 0.1387096643447876), ('The incidence of upper gastrointestinal bleeding and perforation associated with low-dose aspirin is low.', 0.1008155345916748), ('The use of aspirin-containing products for patients with bleeding and perforation has increased markedly in recent years.', 0.7428737282752991), ('The use of aspirin-containing products for patients with bleeding and perforation has increased markedly in recent years.', 0.7428737282752991), ('The safety of aspirin-containing products has been established and is well established.', 0.43254977464675903), ('The use of aspirin-containing products for patients with bleeding and perforation has increased markedly in recent years.', 0.7428737282752991), ('The use of aspirin-containing products for patients with bleeding and perforation has increased markedly in recent years.', 0.7428737282752991), ('The use of aspirin-containing products for patients Aspirin usage is associated with significant risks for Ugi-related conditions, including ulcerative colitis (UGC), although dose may still be present, even at low doses of 300/325 mg or even low amounts of 75 mg.', 0.16619545221328735), ('The idea that enteric-coated aspirin formulations can reduce risk has been put forth by some researchers, who argue that they rely on their ability to resist disintegration in an acid environment and pass through the stomach without dissolution.', 0.9332557916641235), ('This theory is based on the observation that gastric damage caused by enterocoating agents is predominantly localized, and these findings are backed up by endoscopic studies that show less severe gastrious complications than regular forms.', 0.7916460633277893), ('However, there is much debate surrounding the epidemiological evidence regarding the exact relationship of the study tested by both outcomes.', 0.1973254680633545), ('To gain insight into the issue and determine the likelihood of upper gastrointestinal bleeding and perforation caused by aspirin, we used data from a case-control study to estimate the risks associated with drugs and other factors, including dose, duration of treatment, and potential NSAID interaction.', 0.694719672203064)]","[('  Remarkable conclusions The risk of serious upper gastrointestinal complications is still moderate for those taking aspirin at doses as low as 75 mg.', 0.028533101081848145), ('The active principle coating used to spare the stomach does not reduce the risk, neither for the same nor for that of the duodenum.', 0.0021683573722839355), ('Patients using concomitantly low-dose as well as high-discompensation nonaspirine NSAIDs are a subgroup of patients with significant elevated risk factors.', 0.00875842571258545)]"
PMC32173_plagiated.xml,"[('The data suggests that hair color is not influenced by carbamazepine concentration and therefore does not appear to be affected.', 0.9552474617958069), ('Valproic acid concentration may be slightly linked to hair colour, which could be impacted by age.', 0.9026495218276978), ('There is also a significant, moderate relationship between phenytoin concentrations and hair dyeing, with darker hair having higher concentration values than those with lighter hair.', 0.933681070804596)]","[(' This article is an introduction to the study of hair color.', 0.9977098703384399), ('The author Human hair has been used extensively in a range of settings to test for the presence of ingested chemical substances, including being used to determine the level of exposure to heavy metals post-mortem or during living hours.', 0.3676506280899048), ('Other areas have seen significant progress in recovering illicit psychoactive substances and their metabolites from human hair.', 0.529288649559021), ('The enhanced ability to detect and quantify routine drug use enables hair analysis to serve as a valuable diagnostic tool in clinical trials of anti-eizure drugs.', 0.04370319843292236), ('There is a debate about whether hair analysis can accurately measure the presence or absence of compounds, with some suggesting that it cannot be applied to all patients.', 0.9997045397758484), ('There is a lack of clarity regarding the extensive biovariability that can be observed among individuals given the same medication.', 0.44445133209228516), ('Clinicians acknowledge that multiple factors can affect drug concentrations in an analytic matrix, and they recognize that hair samples can provide valuable information about possible effects caused by color differences, cosmetic treatments, or hair hygiene practices.', 0.9451054930686951), ('However, there are still concerns about whether systematic influences can influence drug dosages and compliance with self-reported drugs.', 0.9680231809616089), ('A common flaw in the analysis of hair assay data is the inadequacy of the statistical models used to assess experimental information, which can lead to false claims or conclusions based on unsupported statistical data.', 0.9991511106491089), ('In some cases, the analyses of experimental hair analysis data reveal that these conclusions are far from correct.', 0.746433436870575), ('Nor have any available sophisticated and sensitive statistical techniques been applied to multivariate phenomena.', 0.005175948143005371), ('Despite this, there is a general consensus that the relationship between dose and assync is likely to be mediated by complex series of intervening events.', 0.20511168241500854)]","[('  Remarkable conclusions The assessment of the recovery of CBZ, VPA, and PHT compounds from hair samples indicates that hair color affects drug type significantly, with some effects only slightly different.', 0.012506723403930664)]"
PMC32174_plagiated.xml,"[('The poor information and explanations given by PHRs to stroke patients were not consistent with the reality of the situation.', 0.3103182911872864), ('A PHI did not seem to enhance patient satisfaction or discharge planning, and may have impeded communication and explain any opportunities for improvement.', 0.020430147647857666)]","[("" Introduction 'Improving stroke patients' care: a patient held record is not enough'\n\n'The patient held record is not enough'."", 0.006577432155609131), (""The patient holding record is the first step to improving patients' care by providing a record of the patient's treatment and treatment history."", 0.9842475652694702), ('This is especially important when a new patient is entering the care team.', 0.9970136880874634), (""The patient holding record is the first step to improving patients' care by providing a record of the patient's treatment and treatment history."", 0.9842475652694702), ('This is especially important when a new patient is entering the care team.', 0.9970136880874634), (""The patient held record is the first step to improving patients' care by providing a record of the patient's treatment and treatment history."", 0.965715765953064), (""The patient held record is the first step to improving patients' care by providing a record of the patient's treatment and treatment history."", 0.965715765953064), ('The patient held Rehabilitation teams use PHRs as a means of communicating with patients.', 0.12177020311355591), ('This could help stroke patients to be more informed and participate actively in their care, as well as to contribute to decision making.', 0.9997758269309998)]","[('  Our expectations were unrealistic as they believed the PHR would help bridge the gap between hospital and community, which could have helped maintain continuity of care found elsewhere.', 0.8236725330352783), ('However, our research shows that incorporating a PHI into stroke care, an area of health care often seen as happy and fragmented, was an ambitious undertaking.', 0.9614790678024292), ('It requires more powerful interventions to change the established culture and practice of patient care over time, and even without phrin, it is not practical to implement such systems in acute hospital settings where patients require poor information and explanations for their own.', 0.006123483180999756)]"
PMC32180_plagiated.xml,"[('Our investigation reveals that the expression of AQP8 is indicative of normal colonic epithelial cells, which may indicate their involvement in fluid transport within the colon.', 0.9417346715927124)]","[('NO SIMILAR SENTENCE FOUND ON SEMANTIC CONTROL', 0)]","[('  We hypothesize that AQP8 plays a role in water resorption in the human colon, as demonstrated by our analysis of human columnar surface epithelial cells.', 0.9461009502410889)]"
PMC32181_plagiated.xml,"[('The results indicate that maitotoxin-induced Ca2+ influx in bovine aortic endothelial cells activates COP activation, which is associated with controlled membrane blebbing leading to uncontrolled bleedout, lactate dehydrogenase release, and eventual cell death.', 0.3082658052444458)]","[(' Maitotoxin, a common food additive, is a toxin that causes cell death in the large intestine.', 0.9905475974082947), ('It is found in foods such as milk, cheese, and meat and is commonly found in foods such as fish, poultry, and eggs.', 0.9996169805526733), ('Maitotoxin is also present in the blood and urine of humans, and is thought to be the cause of death in some cases of meningitis.', 0.9992140531539917), ('In the past, it was used to make vaccines to combat meningitis.', 0.9978474378585815), ('The authors of this study tested the effect of Maitotoxin on the membrane of bovine aortic endothelial cells (ABEC), and found that Maitotoxin caused cell death in this cell line.', 0.9958220720291138), ('Maitotoxin increases the expression of Maitotoxicoxin (MTX) is one of the most potent marine toxins, found in the ""red-tide"" dinoflagellate, Gambierdiscus toxicus, and is responsible for seafood poisoning from Ciguatera.', 0.5059452652931213), ('At subnanomolar levels, MTx triggers a significant increase in cytosolic free Ca2+ concentration ([Ca2]i) in all cells examined so far, not by release of Ca 2+ from internal stores, but by activation of large endogenous pores or COP during activated subsequently leading to the identification of Although the kinetic model of the activation or dilation of P2X by MTX is not specific to this toxin, it appears that it initiates a similar cell death cascade in which cytosolic Ca2+ and vital dye uptake are relevant.', 0.005701422691345215), (""The plasmalemma's opening through microscopy suggests that the cell will undergo a significant shift in ionic concentration gradients, leading to increased redistribution of water and swelling of cells."", 0.22520959377288818)]","[('  Remarkable conclusions To sum up, MTX-treated BAECs trigger a cascade of events that includes cell death, CaNSC activation, and increase in [Ca2+]i.', 0.051195621490478516), (""Upon terminating the treatment, however, membrane breaks out and COP is formed, which appears to be 'a unique molecule' associated with the plasma membrane (specifically, the activated nucleotide or its covalent antigen), but it is unclear whether LDH release corresponds to embryonic blood types, massive protoplastytics, etc."", 0.0045070648193359375)]"
