plagiated_file,abstract_sentence,intro_sentence,conclusion_sentence
PMC32313_plagiated.xml,"[('Based on these data, Btk:ER is thought to regulate downstream signaling pathways in B cells primarily via PLC2 (i.e., regulatory protein coupled with nuclear protein chainase inhibitor PLSI 2), and thus it is not known whether activated BukR/STK copy-pasteurs interact with activatededBtky receptor expressed as a ""conditional system"", but this condition will probably allow for the dissection of Btons\' (and other) role in various biological processes in many cell types.', 0.004690945148468018)]","[("" The B cell lymphocytes (BCL) are the most common type of lymphocyte in the human body, and they play a key role in the host's immune response."", 0.9995750784873962), ('BCLs have been shown to be able to express multiple kinases such as tyrosine kinase (TRK) and phosphatidylinositol 3-kinase (PI3K), which are involved in a wide range of biological functions.', 0.9986112117767334), (""However, their role in the host's immune response is poorly understood; the functional roles of BCLs in the immune response have been largely ignored."", 0.8149850964546204), ('Our aim is to develop a conditional form of tyrosine kinase (TYK) that can activate multiple downstream signaling pathways via PLC Gamma 2 in B Btk mutations, which are responsible for the human disease X-linked agammaglobulinemia (reviewed in reference), cause a severe blockage in the pro-B cell transition and result in no mature B cells.', 0.09806567430496216), ('It is hypothesized that a two-way process involving PI 3-kinase and Src family PTK Lyn activates Btk upon cross-linking of the BCR.', 0.010022282600402832), ('This enzyme causes Bkg to become phosphorylated upon binding to the PH domain of Bz3.', 0.682878315448761), ('The significance of Btk in BCR-induced phospholipase (PLC2) phosphatalysis, calcium mobilization, ERK, and NF-B activation and JNK-mediated signaling in deficient B cells has been established through biochemical analyses.', 0.41952812671661377), ('However, it is not clear whether all downstream signals mediated by BTK are PLC2-dependent or if Button alone can perform these functions.', 0.3127323389053345), ('By combining the full-length Btk protein with the hormone-binding domain of the estrogen receptor (Btkg:ER), we have produced a conditional variant of BTK.', 0.7883474826812744), ('We demonstrate that Bukhariya kinase inhibitor BKT-1, KAL1, PLC-2, and PKC-K2 activation alone can activate various downstream signaling pathways in B cells, including calcium mobilization, ERK and JNK MAPK, as well as cellular death by mice.', 0.5344476699829102)]","[('  Remarkable conclusions The Btk mutations observed in XLA patients and the xid mouse indicate that Bfk is essential for B cell development, but the important pathways activated by Bbk remain unresolved.', 0.03190511465072632), ('In our paper, we demonstrate that a conditional form of Bcty can activate multiple signaling pathways downstream of the antigen receptor, including PLC2 phosphorylation, calcium mobilization (MS) activation or ERK and JNK activATION, and that all Bcky-mediated responses are dependent on BKC genes.', 0.7352998852729797)]"
PMC33341_plagiated.xml,"[('By examining the effects of hyperosmotic stress and intracellular acidification on endocytosis, we propose that both hypoxia by high pH and reduced cellular activity are mediated by pleiotropic effects.', 0.517983615398407)]","[(' The mechanism of hyperosmotic stress responses in Dictyostelium discoideum is not well understood.', 0.13019204139709473), ('The major pathways involved include hyperosmotic stress responses, hyperglycemia, hyperinsulinemia, and hyperglycemia induced by glucose.', 0.7181341052055359), ('This review will focus on the mechanisms of hyperglycemia induced by glucose and will discuss the clinical and pathophysiological mechanisms of hyperglycemia induced by glucose.', 0.9624555110931396), ('Hyperglycemia induced by glucose:\n\nDictyostelium discoideum is a case of hyperglycemia induced by glucose.', 0.3566042184829712), ('There is a specific metabolic pathway involved in hyperglycemia induced by glucose.', 0.356666624546051), ('The pathophysiological mechanisms of hyperglycemia induced by glucose are Dehydration causes constant changes in external osmolarity, which can lead to stress conditions.', 0.6089175343513489), ('When the external medium is hyperostatic, cells expel water and shrink rapidly due To restore their volume, mechanisms called ""regulatory volume increase"" (RVI) are activated within minutes.', 0.12448406219482422), ('In addition, when under long-term hyperotic conditions, compatible mosmolytes such as polyols or amines are accumulated inside the cells.', 0.007771432399749756), ('These oases also display a stabilizing effect on proteins, prevent Recent research has revealed that certain cytoskeletal proteins are essential for survival in hypertonic environments, and the amoeba Dictyostelium discoideum exhibits an unusual response to hypertons.', 0.32607215642929077), ('As a result, cells remain shrunken after water extrusion, while other organisms do not accumulate compatible oocytes or stress factors.', 0.0058882832527160645), ('Little knowledge exists about the signalling pathways involved in osmoregulation: for example, an increase in GMP concentration at high stress level (hyperoglycinetosine (GO) concentration), induces apoptogenesis (phosphorylation) of myocardial endothelial cell wall proteins (myopylkinase) and disassembles myramine II heavy chain by phosphoryryling their respective homologues DokA under hypertonic conditions and showing that this pathway.', 0.008445322513580322), ('Moreover, it is hypothesized that cAMP is an essential factor in the spore state (as described above) because of the amoeba developmental program, which naturally causes this hyperotic state; and the well-known adenylyl cyclases G (and is related to as an osmosensor) were found to prevent germination under the hyperostate state in sperm cells (Cytomarkers), but high levels of cleaving cytosol during perimancy.', 0.0033589601516723633), (""The external medium's acidification, which was thought to be caused by hypertonicity and the secretion of protons, was investigated in detail."", 0.163646399974823), ('We questioned whether this correlation is related to an increase in intracellular proton concentration.', 0.784179151058197), ('Cytosolic pH changes have been shown to signal various proteins and cellular processes in many organisms.', 0.7004848122596741), ('Acidification of the cytosol, protein synthesis, DNA chemistry, motility, and alkalinization are also linked to decreased or increased activity or efficiency of a variety of activities.', 0.9197107553482056), ('The paper suggests that cellular activity is generally lower due to high osmolarity, which leads to significant acidification and decreases endocytic activity and NTP pool.', 0.3462963104248047)]","[('  Our findings indicate that Dictyostelium cells under hypertonic conditions display significant internal acidification, depletion of the internal NTP pool, downregulation of vesicular mobility, block fluid-phase endocytosis, and exocellular activity acting as a signal mediator.', 0.03365987539291382)]"
PMC33342_plagiated.xml,"[(""The implications are examined, such as the observation that the data contradicts Masters and Johnson's earlier statement that penis size does not have a direct impact on female sexual satisfaction."", 0.2381453514099121)]","[('NO SIMILAR SENTENCE FOUND ON SEMANTIC CONTROL', 0)]","[(""  The results of women's surveys indicate that penis width was more important for their sexual satisfaction than penisse length."", 0.14600884914398193), ('While Masters and Johnson may have been mistaken about the physiological influence of penises on women, the current data cannot provide a definitive answer.', 0.9961404204368591), ('The findings are dependent on whether the women were advised against using penile measures or withheld payment for medical treatments.', 0.13419127464294434)]"
PMC33343_plagiated.xml,"[('Autoantibodies, particularly ANA and ASMA, are prevalent in patients with HCV seropositive Crete, while LKM1 autoantibody is uncommon.', 0.059302568435668945)]","[(' The prevalence of liver-kidney microsomal autoantibodies (LKM1) in hepatitis C seroposing subjects (HCs) in Greece is extremely low, and in many cases, the prevalence is not greater than 0.1% (1).', 0.8882349133491516), ('In addition, there is a low prevalence of liver-kidney autoantibodies in countries where the prevalence of HCs is higher.', 0.8558234572410583), ('This lack of autoantibodies in HCs results in an elevated risk of hepatitis C when the prevalence of HCs is high (2, 3).', 0.9787078499794006), ('For example, in a study of 15 HCs in the United States (4), the prevalence of autoantibodies of hepatitis B was 1.4% Recent reports have shown a high prevalence of antibodies against hepatitis C (anti-HCV), which is endemic on the island of Crete, where the disease is most frequently reported.', 0.8105620741844177), ('Earlier research has shown that anti-HCV antibodies are frequently present in antigenic subjects, often exhibiting either ANA or smooth muscle antibodies.', 0.3835368752479553), ('In most cases, APA are of the speckled type and ASMA display the ""vasal"" (SMA-V) pattern.', 0.014371156692504883), ('Additionally, chronic hepatitis was associated with LKM1, an autoantibody that reacts with liver and kidney microsomes.', 0.9549180865287781), ('Unfortunately, comparable studies have not been published in Greece.', 0.6511529684066772), ('The aim of the study is to determine the frequency of serum autoantibodies in patients with chronic hepatitis C in Crete.', 0.3019018769264221)]","[('  Remarkable conclusions Ultimately, the serum autoantibodies (ANA and ASMA) are most frequently present in HCV seropositive subjects from Crete; however, there is virtually no known LKM1 antibody.', 0.005194365978240967), ('General Practitioners and Hospital Physicians in Cologne should be aware that these antibodies are more likely to be associated with HCM than with true autoimmune hepatitis A and B.', 0.04110151529312134)]"
PMC33344_plagiated.xml,"[('Fluorescent labeling of SP has been shown to have altered both the biological activity and binding properties of the parent peptide.', 0.6955394148826599), ('The most effective fluorophores for this purpose are Oregon Green 488 and BODIPY FL-SP, which can be used to identify other ways to label SP without affecting its biological function.', 0.9817132353782654), ('These findings suggest that additional research should be conducted to understand the mechanisms of SPR function, such as receptor localization, internalization or recycling.', 0.9936472773551941)]","[(' Phenylpropanediol is a substance found in marijuana and other illicit drugs.', 0.9932621121406555), ('It is a psychoactive compound with a high molecular weight and a high affinity for the cannabinoid receptors.', 0.9893625378608704), ('Phenylpropanediol acts as a endocannabinoid, it is a precursor of the endocannabinoid CB1 and CB2 (Cannabinoid-1 and CB2) receptors.', 0.5658726096153259), ('It is a partial agonist of the CB1 receptor.', 0.9317933917045593), ('Phenylpropanediol can be produced by the extraction of the active ingredient, P-phenylethanolamide, from cannabis plants.', 0.9953446984291077), ('The resulting solvent is then used to extract the active ingredient from the plant material by the use of a solvent extraction procedure.', 0.721046507358551), ('Phenylpropanediol is also known as a Neuronogenesis, smooth muscle control, allergic responses, inflammation, and glandular secretion are all dependent on substance P (SP), which is a peptide neurotransmitter.', 0.320930540561676), ('Fluorophore labeling of many pharmacological agents is now possible due to the recent development of intense, photostable and pH-insensitive fluorophores, as well as improvements in optical detection systems.', 0.8541447520256042), ('Direct labelling of ligand-binding sites using fluorescent probes without radioactivity or antibodies is possible, and re-labeling with a fluoriferous agonist provides an additional benefit over these conventional methods.', 0.6240636706352234), ('Recently, Molecular Probes, Inc. (Eugene, OR) has synthesized five fluorophore-conjugated analogs of SP that can be used to directly label the SPR: Alexa 488, BODIPY Fl, fluoriescein, Oregon Green 487 and tetramethylrhodamine, which are useful for providing a convenient reactive group to the third amino acid of synthetic polymers (LYs3), while others are green fluophores; whereas, they have been independently identified three times four pumps or back up We have compared the activation and labeling of five newly synthesized fluorescent analogs of SP.', 0.014075815677642822), ('The probes have been tested for their ability to bind to the receptor, their receptor activations in a heterologous expression system and native neurons, and their fluorescence effects on the regulatory region of the target receptor; this study provides extensive characterization for the new derivatives produced by SP that will be used in future studies using the fluorescent conjugates.', 0.17898261547088623), ('Oregon Green 488 was found to be the most useful fluoridated compound for labelling of SO astrayray without[', 0.013594985008239746)]","[('  Remarkable conclusions Our research has revealed that the function of SP labeled at the Lys3 position varies significantly with different fluorophores.', 0.15171748399734497), ('Alexa 488, which was the largest and added the most charged groups to SP, was unable to label the SPR and altered the biological activity of ST (sp) in live and cultured cells.', 0.032177865505218506), ('Smaller and uncharged fluoridominants like Oregon Green 498 and BODIPY Fl are likely to serve as good substitutes for this.', 0.004841029644012451)]"
PMC33392_plagiated.xml,"[('We report the first ever genomic characterization (of a RPTP type IIB gene) of an RNA-Protein Terminus complex Recombinant Protopy Tyrosine Triphosphate (RPT-3) segment.Alternatively, different variants may be produced from these RTGAs (recombinate Protease Terminal Terminal Proteins) which are thought to have originated as separate modular proteins that fusion into', 0.02769261598587036)]","[(' The RPTPρ gene encodes a protein that is expressed in the nucleus of the cell.', 0.9893703460693359), ('The gene encodes a protein that is expressed in the nucleus of the cell.', 0.9975640773773193), ('This gene has been identified in multiple human tissues, such as the brain and pancreas, and has also been found in a number of other organisms, including yeast, rodents, and flies.', 0.9997385144233704), ('The RPTPρ gene encodes a protein that is expressed in the nucleus of the cell.', 0.9933527708053589), ('The gene encodes a protein that is expressed in the nucleus of the cell.', 0.9975640773773193), ('The gene has been identified in multiple human tissues, such as the brain and pancreas, and has also been found in a number of other organisms, including yeast, rodents, and flies.', 0.9997313618659973), ('The RPTPρ gene encodes a protein that is expressed in the The regulation of various cellular functions, including signal transduction, growth, differentiation, cell adhesion, and axon guidance, is facilitated by protein tyrosine phosphorylation.', 0.9816484451293945), ('This regulatory mechanism relies on the equilibrium between protein-tYrosines and proteins involved in these functions.', 0.3370131850242615), ('All receptor-like protein (RPTPs) are classified into several classes based on their extracellular region, transmembrane segment(s), and at least one intracellular catalytic domain.', 0.7281557321548462), ('After cleavage, N-terminal segments remain non-covalently There have been reports of type IIB phosphatases (PTP, PTP and RPTP+) that are located on human chromosomes 1, 6, and 18; the hPCP-2 is on chromatin 1; The php-CD[n] and its RNA (cytosine peptide 7), which is believed to be the same as PCP2, with several more human Rpt proteins (like Pepteptapis), including mPPmam4 (#Npappapidase 8 Recent studies have revealed that RPTP, the most recently isolated member of the IIB family, is mostly restricted to the central nervous system.', 0.02162015438079834), ('In the CNS, expression is developmentally controlled and a unique boundary region is formed in what is now known as the cerebellar cortex.', 0.24296480417251587), ('The presence of cytosolic proteins such as serotonin and glutathione indicate that this molecule is involved in signal transmission through the extracellular segment of its RNA.', 0.7504259347915649), ('A sequence of events has been conducted to identify the human RPTP gene, which is mapped to chromosome 20q12-13.1; it is flanked by the phospholipase C gamma 1 and splicing factor SRp55-2 genes, and the mouse gene maps to an area on the left side of the genome that is closely related to Pltp, as well as two other markers, D2Mit22 and D2-Mit52.', 0.31541144847869873), ('The mouse region containing this gene has not been fully assembled.', 0.09228760004043579)]","[(""  Remarkable conclusions This paper presents details on cloning (for the first time), the genomic structure and alternative splicing of mouse and human genes, as well as an 8 kb 3'UTR in human RPTP."", 0.07284748554229736), ('Unlike other RNAs from ESCs, this gene has a significant length: approximately 1 megabase pairs of genomic DNA forms extracellular modules encoded by protein domains (typically around phase 0, and otherwise insignificant) That segment is the largest known PCR enzyme, called the ectodomain1, by the MARN2, by which we know', 0.011502623558044434)]"
PMC33394_plagiated.xml,"[('The cloning of all functional human odorant receptor genes is an essential step in understanding the specificity of receptor-ligands and the combinatorial encoding of olfaction stimuli.', 0.48399287462234497)]","[(' Cannabinoids are the main psychoactive substances found in cannabis.', 0.9844546318054199), ('Cannabinoids bind to cannabinoid receptors in the central nervous system (CNS) to produce a high of euphoria and relaxation.', 0.9979990124702454), ('Cannabinoids also have a number of other effects.', 0.9914275407791138), ('In addition to the psychotropic and appetite-stimulating properties of cannabinoids, there are also many potential uses for cannabis.', 0.999437153339386), ('In this paper, we will be discussing the human olfactory receptor repertoire (HER2) and its role in the regulation of odour perception and behaviour.', 0.9992233514785767), ('As most odour-related research focuses on the effects of cannabinoids in the olfactory system, we will be discussing its role in the regulation of smell perception and behaviour.', 0.8411151766777039), ('We will be focusing on HER2 in the context of the interaction between the olfactory system and In mammals, olfaction is a major neurosensory function that involves identifying external chemical compounds.', 0.9681210517883301), ('The first step in detecting smells is the interaction of an animal with odorant receptors expressed at different sites on their bodies.', 0.17861324548721313), ('Seven-transmembrane ORs were identified as being the largest family of genes in vertebrates, comprising of Class I or A or more (reviewed in 1991), and can include classical G-protein-coupled receptor types such as opsins and catecholamine receptor levels to identify specific categories of the same molecules.', 0.016508400440216064), ('The genes that make up the ORs do not have introns present in their coding regions.', 0.7038693428039551), ('Mammalian OR genes are usually found in sets of ten or more members and located on multiple chromosomes.', 0.62586510181427), ('The majority of human OR (hOR) genes encode pseudogenes, which suggests that olfaction played a less significant role in primate evolution.', 0.9743459224700928), ('However, some research indicates that 70% of all hO receptor genes may be pseudogènes instead of rodents or lower primates.', 0.14216315746307373), ('The recent publication of incomplete compilations of hORs, including approximately 150 full-length receptor genes, has led to the development of annotated sets of OR genes and their products.', 0.6489360928535461), ('The release of the first draft of this sequence by two groups opens up the possibility of comprehensive identification, mapping, and analysis of these products in the near future.', 0.12625622749328613), ('One of those groups reported that the human genome contains 906 OR gene(s), of which approximately 60% appear to be pseudogenes.', 0.09023874998092651), ('Various labs have proposed alternative nomenclatures for a more conventional nomologia for such as at least Prior to studying the rational structure-function of this extensive receptor family, it is essential to identify, clone and classify candidate hORs through a combination of identification, sequence analysis, and comparison with available unannotated raw sequences.', 0.00374448299407959), ('We aimed to determine the complete set of inherited HHOR genes by using reiterative homology searches of GenBank DNA and compiling with other public databases.', 0.041628360748291016), ('Finally, we reported the  Cloning of 347 putative full-length (OR) HORRRRENTLY OR (OHOR', 0.011053502559661865)]","[(""  Remarkable conclusions The functional hOR repertoire's identification and cloning provide a framework for addressing many unresolved issues in human olfactory behavior."", 0.04720395803451538), ('This will, combined with robust heterologous expression and assay systems and high-throughput screening of odorant libraries, help us gain broader access to structures-function relationships and small-molecule recognition by this large group of G-protein-coupled receptors.', 0.01562345027923584), ('Another exciting area of interest is the impact of genetic polymorphism of ORs on human Oleptic resistance syndrome.', 0.4181097149848938), ('Disorder disorders.', 0.14291054010391235)]"
