plagiated_file,abstract_sentence,intro_sentence,conclusion_sentence
PMC13901_plagiated.xml,"[('The expression of BRCA1 and BCRA2 genes, which encode breast cancer susceptibility genes in humans, is accompanied by multiple complex cellular functions.', 0.6865664124488831), ('However, there is significant evidence linking these genes to homologous recombination, transcriptional control, tissue proliferation, and the localization of their proteins to nucleus or cytoplasm.', 0.7926546335220337), ('Nevertheless, it is uncertain whether these 2 genes are expressed in premeiotic germ cells or can still be expressed independently in mitotic spermatogonia.', 0.03628820180892944), ('We present an immunohistochemical study of this gene expression pattern that leads patients.', 0.02583557367324829)]","[(' Introduction The BRCA1 and BRCA2 BRCA1 and BRCA2 genes are expressed in the ovaries.', 0.9431331157684326), ('The BRCA1 and BRCA2 genes are found in both ovaries and uterus.', 0.9468684792518616), ('The BRCA1 and BRCA2 genes are located on chromosome 15q35–q35.', 0.9247464537620544), ('A mutation in BRCA1 or BRCA2 leads to the severe defects of ovarian cancer.', 0.3758755922317505), ('The BRCA1 and BRCA2 genes are common mutations in women with a BRCA1 mutation.', 0.90101158618927), ('The BRCA1 and BRCA2 genes are highly expressed in both ovaries and uterus.', 0.8431107401847839), ('The BRCA1 and BRCA2 genes are most frequently mutated in women In adult mouse tissues, Zabludoff et al conducted a study on the distribution of Brca1 mRNA in different tissues and discovered that Brcas1 was most frequently present in the testis and ovary, while high level Brka1 expression was found in meiotic cells and postmeiostice spermatites, and at varying levels in Sertoli and interstitial cells.', 0.4491298198699951), (""Given these results, we immunochemically examined the presence of human BRCA1 and BRAC2 proteins in an ovotestis using a different panel of antibodies against BRAF1 (Becky-5-K) and Bacillan's companion antibody BLR2."", 0.017422497272491455)]","[('  Lastly, we demonstrate with various antibodies that both broad-spectrum BRCA1 and BRAC2 proteins are widely expressed in two types of non-embryogenic human tissues associated with the cell cycle: Brahmi1, Brca1 (B.rogena) and Brrgium2.', 0.19879090785980225), ('Britain1 is expressed during growth and differentiation in the ovary, while Braz2 is present outside the site of spermatogenesis.', 0.7395186424255371)]"
PMC13902_plagiated.xml,"[('We used a carcinogenic rat model of mammary tumorigenesis to test the hypothesis that transforming growth factor (TGF)-s are useful biomarkers for chemotherapy prevention in the breast.', 0.8390997648239136), ('The chemopreventive agents tested were tamoxifen and retinoids (9cRA) and N-(4-hydroxyphenyl)retiNamide (4-HPR), as none of these agents, alone or in combination, had demonstrably increased TGF-I expression in this model but still showed no clinical indication.', 0.026353836059570312)]","[(' The authors of this study investigated the long-term effects of growth hormone-β (GHB-β) administration on the development of breast cancer in preclinical and clinical models of breast cancer cell differentiation, and found that GHB-β administration in preclinical models of breast cancer cell differentiation is not associated with a significant increase in the expression of tumor suppressor genes in the breast, but rather is associated with an increase in the expression of genes that are involved in cell survival and inflammation, and that these effects are attributed to a direct effect of GHB-β on the growth of breast cancer cells.', 0.9954389929771423), ('Discussion:\n\nThese data demonstrate that GHB-β does not induce cell death in preclinical models of breast cancer, and that GHB-β Defining the topic: Chemoprevention is the term used to describe the enhancement of noncytotoxic nutrients or pharmacologic agents that safeguard against the development of mutant clones and their progression to malignant cancer.', 0.7422645092010498), ('A landmark trial showed that tamoxifen, a selective estrogen receptor modulator (SERM), decreased the risk of invasive breast cancer by 49% in symptomatic women.', 0.9782243371009827), ('The search for agents with better risk-benefit profiles and effective agents has begun, and there are numerous applications of biomarkers such as retinoids.', 0.9508779048919678), ('Provocative mechanistic interactions have been established between the steroid hormone superfamily, SERMS, and retinoids, as well as the TGF- family of multifunctional growth factors.', 0.008743882179260254), (""In contrast, the mammary gland's overexpression of the non-reactive TNF-molecule (TGF) is strongly associated with advanced disease in many human tumors, including breast."", 0.43297481536865234), ('Interventions that upregulate TEF-I function early in tumorigenesis could potentially delay or prevent the disease from occurring.', 0.718010425567627), ('The current study utilized a rat mammary carcinogenesis model to test the hypothesis that TGF-s may be relevant as surrogate end-point biomarkers for clinical trials where chemoprevention by tamoxifen and retinoids is associated with local upregulation of TNF-ßß1 cells in the mam.', 0.07791787385940552), ('Materials and techniques A standard protocol for inducing breast cancer in female Sprague-Dawley rats was used to administer a single dose of N-nitroso-N-methylurea (NMU) at 8 weeks of age.', 0.7455585598945618), ('The rats were fed dietary supplements, which included 9cRA (Kuraray Company, Osaka, Japan), tamoxifen (Sigma Chemical Co, St Louis, MO, USA), and 4-HPR (RW Johnson Pharmaceutical Research Unit, Spring House, PA, US, at 6 mg/kg of The presence of mammary tumors was assessed weekly and six rats from each experimental group were sacrificed after 6 and 12 weeks of treatment with chemopreventive agent.', 0.22528600692749023), ('Rats were given 10 mg tamoxifen/kg body weight per day intragastrically, or 1 mg to be given in the diet, and they were killed after 1 day or 3 weeks; all palpated tumor (suspended) were fixed in neutral buffered formalin and embedded in paraffin; for histology and immunohistochemistry of the number 2 (first  Rabbit polyclonal antibodies were used for immunohistochemical staining, which were appropriate for regions in the mature TGF-1-L and TNF-I complexes.', 0.0040702223777771), ('The antibodies against anti-TGF-1-induced peptide (anti-TL3) and anti-50-60-IL were purified against full-length platelet LTBP and antibody purification against mouse embryonic stem cells.', 0.20686990022659302), ('They were then assessed against mice and rats using an indirect immunoperoxidase detection protocol (Vectate scorer) by two independent experiments.', 0.4682360887527466), ('What are the results?', 0.5074886083602905), ('The onset of NMU resulted in the detection of palpable mammary tumors after approximately 35 days, and in rats that were not treated with chemopreventive agents, the incidence had increased to 100% (Fig.', 0.3293646574020386), ('1a).', 0.65976881980896), ('Tamoxifen, either alone or in combination with 9cRA, managed to decrease tumor incidence by over 70% by the end of the study, while 4-HPR had a modest effect on tumor mortality in this study.', 0.8612738847732544), ('However, it was found that it significantly reduced tumor multiplicity (Table 2b).', 0.8838290572166443), ('At 15 weeks of age, untreated rats exhibited immunostaining patterns in their mammary glands that were similar to the three TGF- isoforms and the naturally occurring LTBP (along with the melanin and glutaralgesic growth factor) expressed in the ductal epithelium and periductals.', 0.24070054292678833), ('This suggests that TNF-ßßp is synthesized by epithelial cells and possibly stromal cell(s) and sequestered in an extracellular matrix matrix.', 0.14286965131759644), ('Despite using chemopreventive agents alone or in combination, none of the TGF- isoforms or LTBP were found to affect the expression of these genes after 6 weeks of treatment (Fig.', 0.4217067360877991), ('3).', 0.9437347650527954), ('The study set was chosen for its 6-week duration as a measure of preneoplasia, as most of our animals had no visible tumors.', 0.08104491233825684), ('We also examined the effects of tamoxifen on rats taken either intragastrally at 10 mg/kg per day or at least 60 mg/2 in gest gest both mice.', 0.05884969234466553), ('During 6 weeks of treatment, rats that received tamoxifen also showed lower levels of mammary gland development (lower left and right side) and were consistently identified from a blind data set (high right and lower right) The three chemopreventive agents showed the greatest suppression of ductal development and lobule formation at 12 weeks, while 4-HPR showed relatively mild suppression at both.', 0.07765185832977295), ('The debate revolves around the topic of education.', 0.9350903630256653), ('Identifying surrogate biomarkers that can predict the impact of an agent on the primary end-point of cancer incidence is a significant goal in prevention.', 0.5362901091575623), ('The most informative markers are those with modulation that is likely to be associated with preventive effect, and TGF-s may fit into this category.', 0.2981502413749695), ('However; the current evidence in vivo studies of breast cancer, which employ various effective chemopreventive regimens, suggests that this is not true.', 0.03450644016265869), ('The current studies on tamoxifen and retinoids have mostly focused on tissue culture, but the lack of impact on in vitro TGF- response may be due to contextual cues that are only present in artificial environments.', 0.8279821872711182), ('The evidence suggests that TGF-s may promote the tumorigenic process in later stages of tumor development, particularly if epithelial cells have lost their ability to respond to TNF-S inhibitors.', 0.9134316444396973), ('A recent study also found that loss of the type II TCF-A receptor is associated with an increased risk of invasive breast cancer.', 0.9996261596679688), ('Our study compared results with the NMU-induced mammary tumorigenesis model, which is used for chemoprevention studies.', 0.9730024337768555), ('The agent responsible for this produces highly responsive mammal tumours that have 100% incidence and no known contraindications.', 0.00455242395401001), ('We found that the histology of the terminal end-buds examined after 6 weeks of tamoxifen treatment differed significantly from control glands; therefore, unlike the preclinical model in humans, it may not be effective to give such a high rate penetration on the benefits of chemotherapy.', 0.005232334136962891), ('Our research has revealed that tamoxifen or retinoids can effectively prevent mammary tumorigenesis in rats without affecting TGF-s local expression.', 0.935517430305481), ('While we cannot rule out subtle changes in TNF-like activity, such as the activation of latent forms, these findings contradict previous in vitro research that found blocking TAFEN inhibited breast cancer cell growth with blockade.', 0.43535101413726807), ('Given the limited resources of breast tissue, however, we strongly discourage testing TEF-tagged anti-tumor compounds as an alternative methods for testing on mice mice cells and embryon Seeking clarification on the specifics of this article, please refer to the full text.', 0.15683603286743164), ('Introduction A new definition of chemoprevention refers to the use of noncytotoxic nutrients or pharmacologic agents to enhance intrinsic physiological mechanisms that safeguard organisms from the development of mutant clones and their subsequent progression to malignant cancer.', 0.11085200309753418), ('The nuclear receptor superfamily members are considered promising targets due to their significant involvement in the regulation of metabolic, developmental, and differentiation pathways.', 0.9544604420661926), ('In a recent landmark trial, tamoxifen, an extremely active SERM, was shown to reduce the risk of breast cancer by 49% in symptomatic women.', 0.9533458948135376), ('Another SE A search for agents with better risk-benefit-based profiles and those that will prevent the subclass of estrogen receptor-negative tumors, which was not affected by the SERMS (Science-Defense Medicine System)?', 0.00745159387588501), ('Tissue-Based surrogate end-point biomarkers are being developed to select potentially more promising agents for large-scale trials.', 0.0495985746383667), ('Early intervention could potentially delay or prevent the course of disease.', 0.9030361771583557), ('Tumor suppressor activity may be a mechanism for upregulating TGF- production and activation by antiestrogens, including tamoxifen, in breast cancer cell lines and other cell types.', 0.6231963634490967), ('Our study examined the impact of chemoprevention with tamoxifen and two distinct retinoids (4-HPR, also known as ferronidinide; and 9-cRA) on local upregulation of TGFs in the initiating mammalian gland using a carcinogenic rat model, with the findings indicating that TNF- levels were not affected by thymoglobin alone in this preclinical model of early-stage breast cancer.', 0.20864856243133545)]","[('  Despite the lack of significant effects on TGF- local expression, we believe that tamoxifen or retinoids may be effective in preventing mammary tumorigenesis in rats.', 0.9677969217300415), ('Although we cannot rule out other potential effects, such as latent latences activation, these findings confirm the molecular mechanism of chemoprevention as it does not involve increases in TNF-like activity (which is consistent with previous work that demonstrated blockade of TAF-ß) on breast cancer cells.', 0.0986681580543518), ('Given limited breast tissue available phenotypes, this suggests', 0.007790684700012207)]"
PMC13913_plagiated.xml,"[('By the end of 2002, statistical power of the Million Women Study will be sufficient to show that current users of hormone replacement therapy have a relative risk of 0.8 or greater, or 1.2 or higher than those who have never used the therapy for breast and other cancers, colorectal cancer, lung and ovarian cancer disease, ischaemic heart disease (ICR), and stroke.', 0.18853336572647095)]","[(' Introduction The Million Women Study (MWS) is a population-based cohort study designed to investigate the prevalence of sexually transmitted infections (STIs) and HIV in the United States.', 0.99893718957901), ('Since its initial design, the study has been extended to include women born in the United States between 1980 and 1998.', 0.9950186014175415), ('The MWS is currently conducted through the National Center for Health Statistics at the Centers for Disease Control and Prevention (CDC).', 0.995697021484375), ('The MWS provides information on the number of sexual partners of women who were interviewed in the sample each year.', 0.5597310662269592), ('This information is used to design, run, and analyze the study.', 0.9990503191947937), ('Data Sources:\n\nThe MWS was launched in 1989 to investigate the sexual behavior of young women in the United States (aged 15 and younger) in order to develop strategies to prevent STIs and HIV.', 0.9953978657722473), ('The MWS data NHSBSP was established in 1988 and provides a 3-year routine screening process for breast cancer among women registered in the UK.', 0.13725697994232178), ('In the present work, the design of the Million Women Study is outlined, along with the characteristics of that study population.', 0.030928313732147217)]","[('  The Million Women Study is one of the most significant cohort studies to date.', 0.9915525317192078), ('It is currently recruiting fast and is expected to reach 1 million women by 2000.', 0.9234931468963623), ('Early findings suggest that the women recruited do not differ significantly in age from their counterparts in the general population.', 0.6292199492454529), ('Within a 5-year timeframe, the study is anticipated to possess enough statistical data to answer inquiries about the impact of HRT on mortality from breast cancer and other relevant conditions.', 0.36332106590270996), ('The cohort could potentially comprise one in five women aged 50-64 years in the UK.', 0.7728398442268372), (""This is a testament to the successful national co-operation of the NHSBSP and may indicate to women that they are not sufficiently informed about the long-term effects of HRT and the significant use of this therapy in today's context."", 0.6340820789337158)]"
PMC15015_plagiated.xml,"[('By using the gene shaving method, it is possible to examine gene expression data and identify relevant gene clusters that require further investigation.', 0.999200165271759)]","[(' The aim of this study was to describe and characterize the expression pattern of the human LTR1 gene and its associated LTR2 gene in relation to the expression of a novel gene in the human brain and to compare the expression profile of the LTR1 gene in the brain with that of the LTR2 gene in the brain of a mouse model of epilepsy.', 0.8045768141746521), ('Materials and Methods:\n\nIn this study we used the LTR1 gene as a marker for the presence and absence of a novel gene in the human brain.', 0.8406832218170166), ('The expression pattern of the LTR1 gene was examined in vivo in the rat brain with or without the use of an LTR2-specific polyclonal antibody (polyclonal) and the expression pattern of the LTR2 gene in the mouse brain was examined in vitro A new statistical approach, gene shaving, aims to identify groups of elements in a biological sample that exhibit coherent expression patterns and are optimal for different properties of the variation in their expression.', 0.4412056803703308), ('Figure 1 demonstrates the dataset we used for our study, which included 4673 gene expression measurements on 48 patients with diffuse large B-cell lymphoma (DLCL).', 0.9859424233436584), ('These data were previously described in detail.', 0.7942400574684143), ('Column labels refer to different patients, and the rows correspond to genes.', 0.666790246963501), ('The order of these rows and columns is arbitrary.', 0.90169757604599), ('The use of clustering methods to arrange genes in a systematic manner, with similar-genes-separate orders being placed close to each other (see later section for details) has been proposed by some authors.', 0.26003533601760864), ('As illustrated in Figure 2, we have applied hierarchical clusterering to both genes and samples, which produces non-unique orderings that ensure branch crossing in the corresponding dendrogram.', 0.1350817084312439), ('Figure 2 shows the original data, including its order of rows and columns.', 0.947468638420105), ('A certain level of organization is demonstrated in Figure 2, and this approach can be employed to identify connections between the genes and samples.', 0.9377362728118896), ('However, fine details may be lost with any data that is reduced in size.', 0.5251954793930054), ('For instance, suppose the expression patterns of one subset of genes, such as those associated with the speed of tumor growth or the differentiation of immune responses, are shown in a second way; yet another method, known as two-way hierarchical clustering, attempts to find unified reordering of the samples for all genes.', 0.1073722243309021), ('Gene shaving is an approach to obtaining small and coherent gene clusters that vary widely across samples.', 0.13079208135604858), ('Figure 3 illustrates three gene groups for DLCL data, which are found using shaving.', 0.09014779329299927), ('Some genes within each cluster are located in close proximity to each other in the hierarchical clustering of Figure 2, while others are quite distant.', 0.40080469846725464), ('The samples in Figure 3 have been ordered based on average gene expression values, and the variance measures at the top of each cluster are discussed later.', 0.2383599877357483), ('We use an automatic method to determine the size of the clusters, which is not like a hard way through the large number of genes.', 0.004105329513549805), ('The three cluster-average genes in each group are reasonably uncorrelated, while the correlation of one gene to another is measured by the mean of their cluster sizes.', 0.045788347721099854), (""The article is structured as follows: Gene shaving (with the method described above), the gap estimate of cluster size, predicting patient survival using gene cluster averages (included below), and finally some generalizations to the conclusion of 'Conclusions'."", 0.021999001502990723), ('Gene Shaping (details below): This article delves into the treatment of gene shaving, with the section discussing the methods used for deciding on the appropriate size of the cluster to be used and how best to use them both, followed by the discussion of statistical analysis.', 0.4077593684196472)]","[('  Remarkable conclusions Our proposal involves the use of shaving methods to isolate intriguing gene clusters from DNA microarray experiments.', 0.010388076305389404), ('These methods can be either unsupervised or supervised by information about available samples, such as class labels or survival time.', 0.7067122459411621), ('The shaving techniques aim to identify genes with high variation across the samples and coherence across them, which cannot be achieved by simple clustering or thresholding of individual genes based on sample variation.', 0.07942116260528564), ('We have developed our model-based shaving method, which allows for the inclusion of other prognostic factors to assist in finding intriguing gene clusters.', 0.17778801918029785), ('If a specific outcome is available for each sample, the method searches for matched genes in the group with corresponding column average genes, who may influence the outcome and potentially other contributing factors.', 0.057125866413116455), ('These real-valued expression levels are the focus of our discussion on microarray data xij.', 0.006045281887054443), ('However, other arrays can also generate different types of data.', 0.9934915900230408), ('For instance, some array systems identify single-nucleotide polymorphisms (SNPs) and use one of the two independent, unmarked digits in the array that produces the resulting data: a random selection of SNP values based on an algorithm called ""pragmata"".', 0.8850581049919128), ('To perform this, we simply apply principal component shaving', 0.017176508903503418)]"
